{"assertions":[{"aggregation":"p95","assertion_id":"camera-age","attribute_match":{"topic":"/camera/image"},"kind":"metric","metric_name":"robotics.message.age","operator":"lte","threshold":100,"unit":"ms","window_sec":30}],"authorization":{"mode":"none"},"data_plane_policy":{"data_sharing":false,"max_loss_ratio":0,"max_message_age_ms":100,"private_ipc":false,"shm_transport":false},"dataset_manifest_sha256":"805c8a3361b1ab851084249103044cec5aaefee0018205937f03cd87de23da51","evaluator_requirements":[{"artifact_sha256":"a9f3c61cefdc82ae15ea38847921437b5bf521d6d5a05171226284fe597e7210","distribution":"example-evaluator","entry_point":"example_evaluator:evaluate","namespace":"org.example.vision","receipt_sha256":"7284e73fe06ddba1b0286c53b41eb364459f8dbb1ce0ca5f60077627f38d0258","version":"1.0.0"}],"evidence_policy":{"compression":"zstd","max_segment_duration_sec":60,"max_segment_size_bytes":1073741824,"max_spool_size_bytes":4294967296,"max_upload_lag_sec":120,"recording_mode":"bounded","remote_sink_allowed":false,"retention_class":"pull-request-7d","spool_high_watermark_ratio":0.85,"topics":["/camera/image","/camera/camera_info"],"upload_mode":"local_only"},"execution":{"data_plane_profile":"standard_isolated","data_source":"simulator","hardware_scope":[],"physical_effect":"none","plant_backend":"simulated_physics","security_profile":"none","target_environment":"simulation","test_intent":"functional","time_mode":"simulation_realtime"},"expected_ros_graph":{"actions":[],"lifecycle_nodes":[],"services":[],"topics":[{"first_message_timeout_sec":10,"min_publishers":1,"min_subscribers":1,"name":"/camera/image","qos_profile":"sensor_data","type":"sensor_msgs/msg/Image"},{"first_message_timeout_sec":10,"min_publishers":1,"min_subscribers":0,"name":"/camera/camera_info","qos_profile":"sensor_data","type":"sensor_msgs/msg/CameraInfo"}]},"forbidden_ros_graph":{"actions":[],"services":[],"topics":[]},"metric_definitions":[{"instrument_kind":"histogram","metric_name":"robotics.message.age","temporality":"delta","unit":"ms"}],"model_manifest_sha256":"026ed9af4bb1eb4ed07868acee4d8a5e66aa38767e2f9de5b2eb1b563c1764a5","provider_requirements":{"capabilities":["simulated_physics"],"scene":{"physical_parameters":{"gravity_m_s2":9.80665},"required_entities":["camera"],"required_interfaces":["/camera/image"],"semantic_scene_id":"camera-stream-neutral"}},"scenario_id":"org.example.camera-stream","schema_version":"acceptance-scenario.v1","seed":42,"time_policy":{"max_deadline_miss_ratio":0,"max_time_authority_delivery_latency_ms":5,"max_time_authority_delivery_latency_p50_ms":1,"max_time_authority_delivery_latency_p95_ms":2,"min_realtime_factor":0.95,"time_authority_min_samples":30},"timeouts":{"execution_sec":120,"graph_ready_sec":30,"shutdown_sec":30,"stable_for_sec":3,"startup_sec":60}}
