{
  "schema_version": "acceptance-scenario.v1",
  "scenario_id": "org.example.published-cli",
  "execution": {
    "target_environment": "simulation",
    "hardware_scope": [],
    "physical_effect": "none",
    "test_intent": "functional",
    "data_source": "simulator",
    "plant_backend": "simulated_physics",
    "time_mode": "simulation_realtime",
    "data_plane_profile": "standard_isolated",
    "security_profile": "none"
  },
  "authorization": {
    "mode": "none"
  },
  "forbidden_ros_graph": {
    "topics": [],
    "services": [],
    "actions": []
  },
  "seed": 42,
  "timeouts": {
    "startup_sec": 60,
    "graph_ready_sec": 30,
    "stable_for_sec": 3,
    "execution_sec": 1,
    "shutdown_sec": 30
  },
  "expected_ros_graph": {
    "topics": [
      {
        "name": "/example/counter",
        "type": "std_msgs/msg/UInt64",
        "min_publishers": 1,
        "min_subscribers": 1,
        "first_message_timeout_sec": 10,
        "qos_profile": "sensor_data"
      }
    ],
    "services": [],
    "actions": [],
    "lifecycle_nodes": []
  },
  "assertions": [
    {
      "assertion_id": "counter-age",
      "kind": "metric",
      "metric_name": "robotics.message.age",
      "unit": "ms",
      "aggregation": "p95",
      "operator": "lte",
      "threshold": 100,
      "window_sec": 1,
      "attribute_match": {
        "domain.id": "primary",
        "topic": "/example/counter"
      }
    }
  ],
  "time_policy": {
    "min_realtime_factor": 0.95,
    "max_deadline_miss_ratio": 0,
    "time_authority_min_samples": 30,
    "max_time_authority_delivery_latency_p50_ms": 1,
    "max_time_authority_delivery_latency_p95_ms": 2,
    "max_time_authority_delivery_latency_ms": 5
  },
  "data_plane_policy": {
    "max_message_age_ms": 100,
    "max_loss_ratio": 0,
    "shm_transport": false,
    "data_sharing": false,
    "private_ipc": false
  },
  "evidence_policy": {
    "topics": [
      "/example/counter"
    ],
    "recording_mode": "bounded",
    "compression": "zstd",
    "max_segment_size_bytes": 1073741824,
    "max_segment_duration_sec": 60,
    "max_spool_size_bytes": 4294967296,
    "spool_high_watermark_ratio": 0.85,
    "max_upload_lag_sec": 120,
    "upload_mode": "local_only",
    "retention_class": "pull-request-7d",
    "remote_sink_allowed": false
  },
  "provider_requirements": {
    "capabilities": [
      "simulated_physics"
    ]
  },
  "evaluator_requirements": [],
  "metric_definitions": [
    {
      "metric_name": "robotics.message.age",
      "unit": "ms",
      "instrument_kind": "histogram",
      "temporality": "delta"
    }
  ]
}
